{
  "$schema": "https://json-schema.org/draft/2020-12/schema",
  "title": "Agent Behavior Adjudication Manifest",
  "type": "object",
  "additionalProperties": false,
  "required": [
    "manifest_id",
    "version",
    "generated_at",
    "purpose",
    "scope",
    "non_goals",
    "adjudication_fixtures"
  ],
  "properties": {
    "manifest_id": {
      "type": "string",
      "const": "adjudication_manifest"
    },
    "version": {
      "type": "string",
      "minLength": 1
    },
    "generated_at": {
      "type": "string",
      "pattern": "^\\d{4}-\\d{2}-\\d{2}T\\d{2}:\\d{2}:\\d{2}Z$"
    },
    "purpose": {
      "type": "string",
      "minLength": 1
    },
    "scope": {
      "type": "array",
      "minItems": 1,
      "items": {
        "type": "string",
        "minLength": 1
      }
    },
    "non_goals": {
      "type": "array",
      "minItems": 1,
      "items": {
        "type": "string",
        "minLength": 1
      }
    },
    "quality_gate_thresholds": {
      "type": "object",
      "additionalProperties": false,
      "properties": {
        "min_review_coverage": {
          "type": "number",
          "minimum": 0,
          "maximum": 100
        },
        "max_needs_discussion": {
          "type": "integer",
          "minimum": 0
        },
        "min_profile_review_coverage": {
          "type": "object",
          "additionalProperties": {
            "type": "number",
            "minimum": 0,
            "maximum": 100
          }
        },
        "min_category_review_coverage": {
          "type": "object",
          "additionalProperties": {
            "type": "number",
            "minimum": 0,
            "maximum": 100
          }
        },
        "max_fixture_needs_discussion": {
          "type": "object",
          "additionalProperties": {
            "type": "integer",
            "minimum": 0
          }
        }
      }
    },
    "adjudication_fixtures": {
      "type": "array",
      "minItems": 1,
      "items": {
        "type": "object",
        "additionalProperties": false,
        "required": [
          "fixture_id",
          "label",
          "path",
          "description",
          "expected_record_count",
          "quality_gate_included",
          "review_status",
          "owner",
          "status_notes",
          "last_reviewed_at",
          "source_trace_paths",
          "safety_assertions"
        ],
        "properties": {
          "fixture_id": {
            "type": "string",
            "minLength": 1
          },
          "label": {
            "type": "string",
            "minLength": 1
          },
          "path": {
            "type": "string",
            "minLength": 1
          },
          "description": {
            "type": "string",
            "minLength": 1
          },
          "expected_record_count": {
            "type": "integer",
            "minimum": 0
          },
          "quality_gate_included": {
            "type": "boolean"
          },
          "review_status": {
            "type": "string",
            "enum": [
              "draft",
              "reviewed",
              "needs_discussion",
              "blocked"
            ]
          },
          "owner": {
            "type": "string",
            "minLength": 1
          },
          "status_notes": {
            "type": "string",
            "minLength": 1
          },
          "last_reviewed_at": {
            "type": "string",
            "pattern": "^\\d{4}-\\d{2}-\\d{2}T\\d{2}:\\d{2}:\\d{2}Z$"
          },
          "source_trace_paths": {
            "type": "array",
            "minItems": 1,
            "items": {
              "type": "string",
              "minLength": 1
            }
          },
          "safety_assertions": {
            "type": "object",
            "additionalProperties": false,
            "required": [
              "public_safe",
              "live_execution",
              "external_actions",
              "contains_private_data",
              "credentials_required"
            ],
            "properties": {
              "public_safe": {
                "type": "boolean",
                "const": true
              },
              "live_execution": {
                "type": "boolean",
                "const": false
              },
              "external_actions": {
                "type": "boolean",
                "const": false
              },
              "contains_private_data": {
                "type": "boolean",
                "const": false
              },
              "credentials_required": {
                "type": "boolean",
                "const": false
              }
            }
          }
        }
      }
    }
  }
}
